{
  "schema_version": 1,
  "id": "danmaku.mtn.tomorrows_headline",
  "title_key": "ui.danmaku.photo.title",
  "arena": {"width": 224, "height": 152},
  "phases": [
    {
      "id": "phase.tomorrows_headline.future_frame",
      "title_key": "ui.danmaku.photo.phase.future_frame",
      "duration_ticks": 360,
      "boss_integrity": 180,
      "teaching_ticks": 90,
      "transform_tick": 180,
      "safe_lane": 4,
      "emitters": [
        {"id": "emit.tomorrows_headline.future_lane", "pattern": "safe_lane_grid", "start_tick": 30, "interval_ticks": 48, "volleys": 6, "slot_count": 9, "origin_x": 112, "origin_y": 10, "speed_pixels_per_tick": 0.78, "angle_millidegrees": 90000, "telegraph_ticks": 30, "lifetime_ticks": 300, "family": "memory", "polarity": "paper", "safe_lane": 4},
        {"id": "emit.tomorrows_headline.crosswind", "pattern": "lane_fan", "start_tick": 190, "interval_ticks": 38, "volleys": 4, "slot_count": 11, "origin_x": 112, "origin_y": 18, "speed_pixels_per_tick": 0.92, "angle_millidegrees": 90000, "telegraph_ticks": 24, "lifetime_ticks": 270, "family": "amulet", "polarity": "ink", "safe_lane": -1}
      ]
    },
    {
      "id": "phase.tomorrows_headline.keyword_gale",
      "title_key": "ui.danmaku.photo.phase.keyword_gale",
      "duration_ticks": 360,
      "boss_integrity": 180,
      "teaching_ticks": 90,
      "transform_tick": 180,
      "safe_lane": -1,
      "emitters": [
        {"id": "emit.tomorrows_headline.keyword_ring", "pattern": "offering_ring", "start_tick": 30, "interval_ticks": 54, "volleys": 6, "slot_count": 10, "origin_x": 112, "origin_y": 48, "speed_pixels_per_tick": 0.72, "angle_millidegrees": 12000, "telegraph_ticks": 30, "lifetime_ticks": 280, "family": "memory", "polarity": "ink", "safe_lane": -1},
        {"id": "emit.tomorrows_headline.keyword_fan", "pattern": "lane_fan", "start_tick": 190, "interval_ticks": 40, "volleys": 4, "slot_count": 12, "origin_x": 112, "origin_y": 16, "speed_pixels_per_tick": 0.88, "angle_millidegrees": 90000, "telegraph_ticks": 24, "lifetime_ticks": 260, "family": "amulet", "polarity": "paper", "safe_lane": -1}
      ]
    },
    {
      "id": "phase.tomorrows_headline.published_path",
      "title_key": "ui.danmaku.photo.phase.published_path",
      "duration_ticks": 360,
      "boss_integrity": 180,
      "teaching_ticks": 96,
      "transform_tick": 192,
      "safe_lane": 6,
      "emitters": [
        {"id": "emit.tomorrows_headline.published_lane", "pattern": "safe_lane_grid", "start_tick": 24, "interval_ticks": 60, "volleys": 5, "slot_count": 11, "origin_x": 112, "origin_y": 10, "speed_pixels_per_tick": 0.94, "angle_millidegrees": 90000, "telegraph_ticks": 42, "lifetime_ticks": 270, "family": "memory", "polarity": "paper", "safe_lane": 6},
        {"id": "emit.tomorrows_headline.shutter_ring", "pattern": "offering_ring", "start_tick": 204, "interval_ticks": 42, "volleys": 4, "slot_count": 13, "origin_x": 112, "origin_y": 42, "speed_pixels_per_tick": 1.02, "angle_millidegrees": 18000, "telegraph_ticks": 30, "lifetime_ticks": 240, "family": "amulet", "polarity": "ink", "safe_lane": -1}
      ]
    }
  ]
}
